{
  "$schema": "https://json-schema.org/draft/2020-12/schema",
  "$id": "https://ospp-standard.org/schemas/v1/ble/receipt.schema.json",
  "title": "Receipt",
  "description": "Transaction receipt the station signs for every BLE session and carries to the app in a ReceiptResponse on BLE characteristic FFF6. Contains the complete record of a completed service session for offline reconciliation. v0.4.2: outer wrapper includes offlinePassId / userId / deviceId for symmetry with the signed inner body (06-security.md §6.2 receipt_fields). v0.6.0: discriminated (oneOf) — pass-form carries {offlinePassId, passCounter} (N7); auth-form (Partial A) carries {authId, sessionId} (Q4); both mirror the signed receipt.data body. The four settlement fields of 06-security.md §6.2 (stationId, endReason, bookedDurationSeconds, clockState) are signed only: they are inside receipt.data and not in this wrapper.",
  "type": "object",
  "required": [
    "offlineTxId",
    "userId",
    "deviceId",
    "bayId",
    "serviceId",
    "startedAt",
    "endedAt",
    "durationSeconds",
    "creditsCharged",
    "receipt",
    "txCounter"
  ],
  "additionalProperties": false,
  "oneOf": [
    {
      "title": "pass-form (Full Offline / Partial B)",
      "required": [
        "offlinePassId",
        "passCounter"
      ],
      "properties": {
        "authId": false,
        "sessionId": false
      }
    },
    {
      "title": "auth-form (Partial A — ServerSignedAuth)",
      "required": [
        "authId",
        "sessionId"
      ],
      "properties": {
        "offlinePassId": false,
        "passCounter": false
      }
    }
  ],
  "properties": {
    "offlineTxId": {
      "$ref": "../common/offline-tx-id.schema.json"
    },
    "offlinePassId": {
      "$ref": "../common/offline-pass-id.schema.json",
      "description": "Pass-form only. OfflinePass identifier used to authorize this service. Matches the value signed into receipt.data per 06-security.md §6.2."
    },
    "passCounter": {
      "type": "integer",
      "minimum": 0,
      "description": "Pass-form only. The pass's app-global usage counter, matching the value signed into receipt.data (finding N7)."
    },
    "authId": {
      "type": "string",
      "pattern": "^auth_[a-f0-9]{8,}$",
      "minLength": 13,
      "maxLength": 64,
      "description": "Auth-form (Partial A) only. ServerSignedAuth authId, matching the value signed into receipt.data (finding Q4)."
    },
    "sessionId": {
      "$ref": "../common/session-id.schema.json",
      "description": "Auth-form (Partial A) only. Server-issued session, matching the value signed into receipt.data (finding Q4)."
    },
    "userId": {
      "$ref": "../common/user-id.schema.json",
      "description": "User subject identifier. Matches the value signed into receipt.data per 06-security.md §6.2 (v0.4.2)."
    },
    "deviceId": {
      "type": "string",
      "minLength": 1,
      "maxLength": 128,
      "description": "The device the session was authorized for - the pass's deviceId, or the authorization's. Matches the value signed into receipt.data per 06-security.md §6.2 (v0.4.2)."
    },
    "bayId": {
      "$ref": "../common/bay-id.schema.json"
    },
    "serviceId": {
      "$ref": "../common/service-id.schema.json"
    },
    "startedAt": {
      "$ref": "../common/timestamp.schema.json",
      "description": "ISO 8601 timestamp when the service started"
    },
    "endedAt": {
      "$ref": "../common/timestamp.schema.json",
      "description": "ISO 8601 timestamp when the service ended"
    },
    "durationSeconds": {
      "type": "integer",
      "minimum": 1,
      "description": "Total duration of the service in seconds"
    },
    "creditsCharged": {
      "$ref": "../common/credit-amount.schema.json"
    },
    "meterValues": {
      "$ref": "../common/meter-values.schema.json",
      "description": "Final meter readings from the completed service"
    },
    "receipt": {
      "$ref": "../common/receipt.schema.json"
    },
    "txCounter": {
      "type": "integer",
      "minimum": 1,
      "description": "Monotonically increasing transaction counter for chain integrity"
    }
  }
}
