{
  "offlineTxId": "otx_e4d3c2b1a0f9e8d7c6b5",
  "offlinePassId": "opass_e4d3c2b1a0f9e8d7",
  "passCounter": 59,
  "userId": "sub_e4d3c2b1a0f9e8d7c6b5a4938271e4d3",
  "deviceId": "dev_e4d3c2b1",
  "bayId": "bay_f6e5d4c3b2a10987",
  "serviceId": "svc_premium",
  "startedAt": "2026-02-15T14:30:00.000Z",
  "endedAt": "2026-02-15T14:45:00.000Z",
  "durationSeconds": 900,
  "creditsCharged": 200,
  "meterValues": {
    "liquidMl": 45600,
    "consumableMl": 1200,
    "energyWh": 3500
  },
  "receipt": {
    "data": "eyJiYXlJZCI6ImJheV9mNmU1ZDRjM2IyYTEwOTg3IiwiYm9va2VkRHVyYXRpb25TZWNvbmRzIjo5MDAsImNsb2NrU3RhdGUiOiJTeW5jaHJvbml6ZWQiLCJjcmVkaXRzQ2hhcmdlZCI6MjAwLCJkZXZpY2VJZCI6ImRldl9lNGQzYzJiMSIsImR1cmF0aW9uU2Vjb25kcyI6OTAwLCJlbmRSZWFzb24iOiJUaW1lckV4cGlyZWQiLCJlbmRlZEF0IjoiMjAyNi0wMi0xNVQxNDo0NTowMC4wMDBaIiwibWV0ZXJWYWx1ZXMiOnsiY29uc3VtYWJsZU1sIjoxMjAwLCJlbmVyZ3lXaCI6MzUwMCwibGlxdWlkTWwiOjQ1NjAwfSwib2ZmbGluZVBhc3NJZCI6Im9wYXNzX2U0ZDNjMmIxYTBmOWU4ZDciLCJvZmZsaW5lVHhJZCI6Im90eF9lNGQzYzJiMWEwZjllOGQ3YzZiNSIsInBhc3NDb3VudGVyIjo1OSwic2VydmljZUlkIjoic3ZjX3ByZW1pdW0iLCJzdGFydGVkQXQiOiIyMDI2LTAyLTE1VDE0OjMwOjAwLjAwMFoiLCJzdGF0aW9uSWQiOiJzdG5fZmYyZmM3NmUiLCJ0eENvdW50ZXIiOjgsInVzZXJJZCI6InN1Yl9lNGQzYzJiMWEwZjllOGQ3YzZiNWE0OTM4MjcxZTRkMyJ9",
    "signature": "MEUCIQD1loq9BuUTTPbtdejp5ytICvB+sLVtQ18qOI/G2nHp2gIgUHmlwJhyZHifwXwdmcEj5LKWLicdG4maPsPvBzQ/WEY=",
    "signatureAlgorithm": "ECDSA-P256-SHA256"
  },
  "txCounter": 8
}
