{
  "offlineTxId": "otx_a1b2c3d4e5f6a7b8193bf9eb15d531f8",
  "offlinePassId": "opass_a1b2c3d4e5f6a7b8",
  "passCounter": 17,
  "userId": "sub_a1b2c3d4e5f6a7b8",
  "deviceId": "dev_ble_a1b2c3d4",
  "bayId": "bay_a1b2c3d4e5f6",
  "serviceId": "svc_eco",
  "startedAt": "2026-02-13T10:00:00.000Z",
  "endedAt": "2026-02-13T10:04:58.000Z",
  "durationSeconds": 298,
  "creditsCharged": 50,
  "meterValues": {
    "liquidMl": 45200,
    "consumableMl": 500,
    "energyWh": 150
  },
  "receipt": {
    "data": "eyJiYXlJZCI6ImJheV9hMWIyYzNkNGU1ZjYiLCJib29rZWREdXJhdGlvblNlY29uZHMiOjMwMCwiY2xvY2tTdGF0ZSI6IlN5bmNocm9uaXplZCIsImNyZWRpdHNDaGFyZ2VkIjo1MCwiZGV2aWNlSWQiOiJkZXZfYmxlX2ExYjJjM2Q0IiwiZHVyYXRpb25TZWNvbmRzIjoyOTgsImVuZFJlYXNvbiI6IkxvY2FsIiwiZW5kZWRBdCI6IjIwMjYtMDItMTNUMTA6MDQ6NTguMDAwWiIsIm1ldGVyVmFsdWVzIjp7ImNvbnN1bWFibGVNbCI6NTAwLCJlbmVyZ3lXaCI6MTUwLCJsaXF1aWRNbCI6NDUyMDB9LCJvZmZsaW5lUGFzc0lkIjoib3Bhc3NfYTFiMmMzZDRlNWY2YTdiOCIsIm9mZmxpbmVUeElkIjoib3R4X2ExYjJjM2Q0ZTVmNmE3YjgxOTNiZjllYjE1ZDUzMWY4IiwicGFzc0NvdW50ZXIiOjE3LCJzZXJ2aWNlSWQiOiJzdmNfZWNvIiwic3RhcnRlZEF0IjoiMjAyNi0wMi0xM1QxMDowMDowMC4wMDBaIiwic3RhdGlvbklkIjoic3RuX2ExYjJjM2Q0IiwidHhDb3VudGVyIjo1LCJ1c2VySWQiOiJzdWJfYTFiMmMzZDRlNWY2YTdiOCJ9",
    "signature": "MEQCIB/br4lLsl5vO5aTaryEC0pvXldN9MvZNu1GbOOZlYy+AiAexw8siTND7xgX4nJSTca+lmXetfz8a8+9Y3CaQv9ezw==",
    "signatureAlgorithm": "ECDSA-P256-SHA256"
  },
  "txCounter": 5
}
