{
  "offlineTxId": "otx_a1b2c3d4e5f6d00b1ce6710722821c33",
  "authId": "auth_4a4c917bf87f",
  "sessionId": "sess_b3c4d5e6",
  "userId": "sub_e4d3c2b1a0f9e8d7c6b5a4938271e4d3",
  "deviceId": "dev_a1b2c3d4",
  "bayId": "bay_f6e5d4c3b2a10987",
  "serviceId": "svc_eco",
  "startedAt": "2026-03-01T14:30:00.000Z",
  "endedAt": "2026-03-01T14:45:00.000Z",
  "durationSeconds": 900,
  "creditsCharged": 50,
  "receipt": {
    "data": "eyJhdXRoSWQiOiJhdXRoXzRhNGM5MTdiZjg3ZiIsImJheUlkIjoiYmF5X2Y2ZTVkNGMzYjJhMTA5ODciLCJib29rZWREdXJhdGlvblNlY29uZHMiOjkwMCwiY2xvY2tTdGF0ZSI6IlN5bmNocm9uaXplZCIsImNyZWRpdHNDaGFyZ2VkIjo1MCwiZGV2aWNlSWQiOiJkZXZfYTFiMmMzZDQiLCJkdXJhdGlvblNlY29uZHMiOjkwMCwiZW5kUmVhc29uIjoiVGltZXJFeHBpcmVkIiwiZW5kZWRBdCI6IjIwMjYtMDMtMDFUMTQ6NDU6MDAuMDAwWiIsIm9mZmxpbmVUeElkIjoib3R4X2ExYjJjM2Q0ZTVmNmQwMGIxY2U2NzEwNzIyODIxYzMzIiwic2VydmljZUlkIjoic3ZjX2VjbyIsInNlc3Npb25JZCI6InNlc3NfYjNjNGQ1ZTYiLCJzdGFydGVkQXQiOiIyMDI2LTAzLTAxVDE0OjMwOjAwLjAwMFoiLCJzdGF0aW9uSWQiOiJzdG5fYjc1YTRmYWQiLCJ0eENvdW50ZXIiOjMsInVzZXJJZCI6InN1Yl9lNGQzYzJiMWEwZjllOGQ3YzZiNWE0OTM4MjcxZTRkMyJ9",
    "signature": "MEQCIA+eq8JTwbRPdXADmnpspktQ9kqboLQt4WNwN/rAV9dnAiAPUDPYCtxBeqih2jac4j0TI804p5V660y7uakFLxA/7g==",
    "signatureAlgorithm": "ECDSA-P256-SHA256"
  },
  "txCounter": 3
}
